{
  "entries": [
    {
      "admissionRequirements": [
        "Exact TTK_1530 version and checksum",
        "Exact commercial goods or services supply evidence",
        "Exact invoice or equivalent payment-request evidence",
        "Exact delivery or performance date and due-date evidence",
        "Exact debtor and liability-context binding",
        "Positive amount in integer minor units"
      ],
      "allowedFormationPaths": [
        "CLAIM_ITEM_FORMATION_INTENT_V1_APPROVED_FINALIZATION"
      ],
      "amountSemantics": {
        "fixedAtFormation": true,
        "minorUnitRepresentation": "POSITIVE_INTEGER_STRING",
        "roundingFallback": "PROHIBITED",
        "semanticAuthority": "STATUTORY_COMMERCIAL_COLLECTION_COST"
      },
      "calculationSemantics": {
        "futureAccrual": "PROHIBITED",
        "rule": "FORM_EXACT_LEGALLY_SUPPORTED_COLLECTION_COST_ONLY",
        "sourceAmountDerivation": "EXACT_SOURCE_EVIDENCE_REQUIRED"
      },
      "canonicalComponentCategory": "COST",
      "currencySemantics": {
        "conversion": "PROHIBITED",
        "currencyAuthority": "EXACT_SOURCE_CURRENCY",
        "minorUnitAuthority": "ISO_CURRENCY_MINOR_UNIT"
      },
      "displayName": "Commercial Collection Cost",
      "effectiveFrom": "2026-07-26T00:00:00Z",
      "effectiveUntil": null,
      "finalizationRequirements": [
        "Revalidate exact Legal Basis version and checksum",
        "Revalidate exact source version and fingerprint",
        "Revalidate commercial-supply and liability compatibility",
        "Persist ClaimItem and immutable formation snapshot atomically"
      ],
      "forbiddenFormationPaths": [
        "DIRECT_CLAIM_ITEM_WRITE",
        "GENERIC_COMPONENT_FALLBACK",
        "CURRENT_LATEST_OR_DEFAULT_RESOLUTION",
        "HISTORICAL_RECLASSIFICATION"
      ],
      "interestEligibility": {
        "componentAccruesFurtherInterest": false,
        "eligibilityRule": "NOT_AN_INTEREST_COMPONENT",
        "requiresExactInterestPolicy": false,
        "requiresExactRateAuthority": false
      },
      "legalBasisBindings": {
        "allowedLegalBasisCodes": [
          "TTK_1530"
        ],
        "bindingMode": "EXACTLY_ONE",
        "requiredLegalBasisCodes": [
          "TTK_1530"
        ]
      },
      "legalCharacter": "STATUTORY_COST",
      "legalMeaning": "A fixed commercial collection-cost receivable authorized only for a qualifying TTK_1530 commercial goods or services supply.",
      "liabilityCompatibility": {
        "allowedLiabilityTypes": [
          "KISMI",
          "SINIRLI",
          "TAM"
        ],
        "crossLiabilityUse": "PROHIBITED",
        "scope": "EXACT_SAME_DEBTOR_AND_LIABILITY_RELATIONSHIP"
      },
      "lifecycle": {
        "activation": "RATIFIED_BUT_RUNTIME_DORMANT",
        "revocationBehavior": "FAIL_CLOSED_FOR_NEW_FORMATION",
        "versionUpgrade": "EXPLICIT_NEW_VERSION_ONLY"
      },
      "notes": "Not available for consumer, employment or unrelated commercial debts; it never supplies principal or interest authority.",
      "requiredEvidenceTypes": [
        "COMMERCIAL_PARTY_STATUS_EVIDENCE",
        "DELIVERY_OR_PERFORMANCE_DATE_EVIDENCE",
        "DUE_DATE_OR_PAYMENT_TERM_EVIDENCE",
        "INVOICE_OR_EQUIVALENT_PAYMENT_REQUEST",
        "LIABILITY_CONTEXT_HASH",
        "QUALIFYING_COMMERCIAL_SUPPLY_EVIDENCE"
      ],
      "requiredSourceTypes": [
        "EXACT_DOCUMENT_SOURCE_VERSION",
        "EXACT_LEGAL_BASIS_RELEASE_ENTRY",
        "EXACT_LIABILITY_CONTEXT"
      ],
      "snapshotRequirements": [
        "Registry identity version checksum and subtype version",
        "Exact Legal Basis identity version checksum and release identity",
        "Exact source identity version fingerprint and evidence references",
        "Exact amount currency minor unit and liability-context hash"
      ],
      "status": "RATIFIED",
      "subtypeCode": "COMMERCIAL_COLLECTION_COST",
      "subtypeVersion": 1,
      "supersededBy": null,
      "supersedes": []
    },
    {
      "admissionRequirements": [
        "Exactly one exact KANUN_3095_2 or TTK_1530 version and checksum",
        "Exact commercial character evidence",
        "Exact default-start evidence",
        "Exact rate or policy version",
        "Exact debtor and liability-context binding",
        "Positive accrued amount in integer minor units"
      ],
      "allowedFormationPaths": [
        "CLAIM_ITEM_FORMATION_INTENT_V1_APPROVED_FINALIZATION"
      ],
      "amountSemantics": {
        "fixedAtFormation": true,
        "minorUnitRepresentation": "POSITIVE_INTEGER_STRING",
        "roundingFallback": "PROHIBITED",
        "semanticAuthority": "ACCRUED_COMMERCIAL_DEFAULT_INTEREST"
      },
      "calculationSemantics": {
        "futureAccrual": "INTEREST_POLICY_ONLY",
        "rule": "FORM_ONLY_ACCRUED_AMOUNT_THROUGH_EFFECTIVE_DATE",
        "sourceAmountDerivation": "EXACT_RATE_POLICY_AND_DATE_INPUTS_REQUIRED"
      },
      "canonicalComponentCategory": "ACCRUED_INTEREST",
      "currencySemantics": {
        "conversion": "PROHIBITED",
        "currencyAuthority": "EXACT_UNDERLYING_MONETARY_DEBT_CURRENCY",
        "minorUnitAuthority": "ISO_CURRENCY_MINOR_UNIT"
      },
      "displayName": "Commercial Default Interest",
      "effectiveFrom": "2026-07-26T00:00:00Z",
      "effectiveUntil": null,
      "finalizationRequirements": [
        "Revalidate exact Legal Basis version and checksum",
        "Revalidate exact source version and fingerprint",
        "Revalidate commercial character default start rate and liability compatibility",
        "Persist ClaimItem and immutable formation snapshot atomically"
      ],
      "forbiddenFormationPaths": [
        "DIRECT_CLAIM_ITEM_WRITE",
        "GENERIC_COMPONENT_FALLBACK",
        "CURRENT_LATEST_OR_DEFAULT_RESOLUTION",
        "FUTURE_INTEREST_AS_FIXED_CLAIM_ITEM",
        "HISTORICAL_RECLASSIFICATION"
      ],
      "interestEligibility": {
        "componentAccruesFurtherInterest": false,
        "eligibilityRule": "COMMERCIAL_DEFAULT_CONDITIONS_AND_EXACT_RATE_AUTHORITY_REQUIRED",
        "requiresExactInterestPolicy": true,
        "requiresExactRateAuthority": true
      },
      "legalBasisBindings": {
        "allowedLegalBasisCodes": [
          "KANUN_3095_2",
          "TTK_1530"
        ],
        "bindingMode": "EXACTLY_ONE_OF",
        "requiredLegalBasisCodes": []
      },
      "legalCharacter": "COMMERCIAL_DEFAULT_INTEREST",
      "legalMeaning": "Interest accrued after commercial default where exact statutory or qualifying TTK_1530 authority, commercial character, default start and rate inputs are proven.",
      "liabilityCompatibility": {
        "allowedLiabilityTypes": [
          "KISMI",
          "SINIRLI",
          "TAM"
        ],
        "crossLiabilityUse": "PROHIBITED",
        "scope": "EXACT_SAME_DEBTOR_AND_LIABILITY_RELATIONSHIP"
      },
      "lifecycle": {
        "activation": "RATIFIED_BUT_RUNTIME_DORMANT",
        "revocationBehavior": "FAIL_CLOSED_FOR_NEW_FORMATION",
        "versionUpgrade": "EXPLICIT_NEW_VERSION_ONLY"
      },
      "notes": "TTK_1530 use is confined to qualifying commercial goods or services supply; KANUN_3095_2 and TTK_1530 are alternatives, not an implicit fallback chain.",
      "requiredEvidenceTypes": [
        "COMMERCIAL_CHARACTER_EVIDENCE",
        "DEFAULT_START_EVIDENCE",
        "EXACT_INTEREST_POLICY_OR_RATE_RECORD",
        "LIABILITY_CONTEXT_HASH",
        "MONETARY_DEBT_EVIDENCE"
      ],
      "requiredSourceTypes": [
        "EXACT_DOCUMENT_SOURCE_VERSION",
        "EXACT_INTEREST_POLICY_VERSION",
        "EXACT_LEGAL_BASIS_RELEASE_ENTRY",
        "EXACT_LIABILITY_CONTEXT"
      ],
      "snapshotRequirements": [
        "Registry identity version checksum and subtype version",
        "Exact Legal Basis identity version checksum and release identity",
        "Exact source identity version fingerprint and commercial evidence references",
        "Exact accrued amount currency minor unit effective date rate policy and liability-context hash"
      ],
      "status": "RATIFIED",
      "subtypeCode": "COMMERCIAL_DEFAULT_INTEREST",
      "subtypeVersion": 1,
      "supersededBy": null,
      "supersedes": []
    },
    {
      "admissionRequirements": [
        "Exact TBK_120 version and checksum",
        "Exact contractual interest clause",
        "Exact default-start evidence",
        "Exact contractual rate and legal-limit inputs",
        "Exact debtor and liability-context binding",
        "Positive accrued amount in integer minor units"
      ],
      "allowedFormationPaths": [
        "CLAIM_ITEM_FORMATION_INTENT_V1_APPROVED_FINALIZATION"
      ],
      "amountSemantics": {
        "fixedAtFormation": true,
        "minorUnitRepresentation": "POSITIVE_INTEGER_STRING",
        "roundingFallback": "PROHIBITED",
        "semanticAuthority": "ACCRUED_CONTRACTUAL_DEFAULT_INTEREST"
      },
      "calculationSemantics": {
        "futureAccrual": "INTEREST_POLICY_ONLY",
        "rule": "FORM_ONLY_ACCRUED_AMOUNT_WITH_CONTRACTUAL_RATE_AND_LEGAL_LIMITS",
        "sourceAmountDerivation": "EXACT_CONTRACT_RATE_POLICY_AND_DATE_INPUTS_REQUIRED"
      },
      "canonicalComponentCategory": "ACCRUED_INTEREST",
      "currencySemantics": {
        "conversion": "PROHIBITED",
        "currencyAuthority": "EXACT_UNDERLYING_MONETARY_DEBT_CURRENCY",
        "minorUnitAuthority": "ISO_CURRENCY_MINOR_UNIT"
      },
      "displayName": "Contractual Default Interest",
      "effectiveFrom": "2026-07-26T00:00:00Z",
      "effectiveUntil": null,
      "finalizationRequirements": [
        "Revalidate exact Legal Basis version and checksum",
        "Revalidate exact contract source version and fingerprint",
        "Revalidate contractual clause default start rate limits and liability compatibility",
        "Persist ClaimItem and immutable formation snapshot atomically"
      ],
      "forbiddenFormationPaths": [